{
  "$schema": "../../schemas/arch01/metric_catalog.schema.json",
  "artifact_id": "ARCH01_MICHIGAN_PRESENTATION_METRIC_CATALOG_V1",
  "version": "1.0.0",
  "status": "architecture_evidence_awaiting_acceptance",
  "expected_metric_count": 16,
  "missing_value_policy": "Missing, invalid, inapplicable, and noncomputable values remain unavailable, never become zero, never enter robust-domain calculation, and render with the neutral No Data / Unavailable treatment.",
  "metrics": [
    {
      "metric_key": "customer_fit_percentile",
      "display_name": "Customer Fit Percentile",
      "sort_order": 1,
      "family": "model_proxy",
      "unit": "statewide percentile",
      "format_policy": "percentile_1",
      "definition": "Percentile position of the accepted customer-fit public-data proxy among computable Michigan tracts.",
      "source_authority_id": "MODEL13_MICHIGAN_POWER_BI_OUTPUT_CONTRACT_V1",
      "source_label": "Accepted MODEL-13 Michigan public-data proxy output",
      "scale_policy": "fixed_0_100",
      "palette": "model_proxy_sequential",
      "availability_policy": "Available only when the accepted MODEL-13 tract output is computable.",
      "warning_policy": "Show model noncomputability and relevant support-truncation context.",
      "input_binding": {"logical_input": "model13_tract_output", "column": "customer_fit_statewide_percentile"},
      "synthetic_range": [0, 100]
    },
    {
      "metric_key": "household_opportunity_5_mile",
      "display_name": "5-Mile Household Opportunity",
      "sort_order": 2,
      "family": "household_opportunity",
      "unit": "households",
      "format_policy": "count_0",
      "definition": "Accepted raw five-mile B11001 household opportunity mass around the tract's public internal-point anchor.",
      "source_authority_id": "MODEL13_MICHIGAN_POWER_BI_OUTPUT_CONTRACT_V1",
      "source_label": "Accepted MODEL-13 Michigan household-opportunity output",
      "scale_policy": "statewide_valid_p02_p98",
      "palette": "model_proxy_sequential",
      "availability_policy": "Use only valid accepted household-opportunity values; no missing-to-zero conversion.",
      "warning_policy": "Show five-mile support-truncation context when applicable.",
      "input_binding": {"logical_input": "model13_tract_output", "column": "household_opportunity"},
      "synthetic_range": [12000, 210000]
    },
    {
      "metric_key": "modeled_target_mass_percentile",
      "display_name": "Modeled Target Mass Percentile",
      "sort_order": 3,
      "family": "model_proxy",
      "unit": "statewide percentile",
      "format_policy": "percentile_1",
      "definition": "Percentile position of the accepted modeled target-mass output among computable Michigan tracts.",
      "source_authority_id": "MODEL13_MICHIGAN_POWER_BI_OUTPUT_CONTRACT_V1",
      "source_label": "Accepted MODEL-13 Michigan modeled target-mass output",
      "scale_policy": "fixed_0_100",
      "palette": "model_proxy_sequential",
      "availability_policy": "Available only when the accepted MODEL-13 tract output is computable.",
      "warning_policy": "Show model noncomputability and relevant support-truncation context.",
      "input_binding": {"logical_input": "model13_tract_output", "column": "modeled_target_mass_statewide_percentile"},
      "synthetic_range": [0, 100]
    },
    {
      "metric_key": "median_household_income",
      "display_name": "Median Household Income",
      "sort_order": 4,
      "family": "economic_capacity",
      "unit": "2024 inflation-adjusted dollars",
      "format_policy": "currency_0",
      "definition": "Median household income in the past 12 months for households in the tract; not Average Household Income or Area Median Income.",
      "source_authority_id": "DATA04_MICHIGAN_PUBLIC_DATA_PARITY_SOURCE_CONTRACT_V1",
      "source_label": "U.S. Census Bureau, 2020-2024 ACS 5-Year Detailed Tables",
      "scale_policy": "statewide_valid_p02_p98",
      "palette": "descriptive_sequential",
      "availability_policy": "Use only DATA-04 rows whose accepted measure status is valid.",
      "warning_policy": "Show DATA-04 status, status detail, and margin of error.",
      "input_binding": {"logical_input": "data04_candidate_measure", "measure_id": "median_household_income"},
      "synthetic_range": [25000, 160000]
    },
    {
      "metric_key": "per_capita_income",
      "display_name": "Per Capita Income",
      "sort_order": 5,
      "family": "economic_capacity",
      "unit": "2024 inflation-adjusted dollars",
      "format_policy": "currency_0",
      "definition": "Aggregate income in the past 12 months divided by the tract population.",
      "source_authority_id": "DATA04_MICHIGAN_PUBLIC_DATA_PARITY_SOURCE_CONTRACT_V1",
      "source_label": "U.S. Census Bureau, 2020-2024 ACS 5-Year Detailed Tables",
      "scale_policy": "statewide_valid_p02_p98",
      "palette": "descriptive_sequential",
      "availability_policy": "Use only DATA-04 rows whose accepted measure status is valid.",
      "warning_policy": "Show DATA-04 status, status detail, and margin of error.",
      "input_binding": {"logical_input": "data04_candidate_measure", "measure_id": "per_capita_income"},
      "synthetic_range": [15000, 80000]
    },
    {
      "metric_key": "civilian_labor_force_share",
      "display_name": "Civilian Labor Force Share",
      "sort_order": 6,
      "family": "economic_capacity",
      "unit": "percent of population age 16+",
      "format_policy": "percent_1",
      "definition": "Civilian labor force as a share of the population age 16 years and over.",
      "source_authority_id": "DATA04_MICHIGAN_PUBLIC_DATA_PARITY_SOURCE_CONTRACT_V1",
      "source_label": "U.S. Census Bureau, 2020-2024 ACS 5-Year Detailed Tables",
      "scale_policy": "statewide_valid_p02_p98",
      "palette": "descriptive_sequential",
      "availability_policy": "Use only DATA-04 rows whose accepted measure status is valid.",
      "warning_policy": "Show DATA-04 status, status detail, and margin of error.",
      "input_binding": {"logical_input": "data04_candidate_measure", "measure_id": "civilian_labor_force_share"},
      "synthetic_range": [35, 80]
    },
    {
      "metric_key": "employment_rate",
      "display_name": "Employment Rate",
      "sort_order": 7,
      "family": "economic_capacity",
      "unit": "percent of civilian labor force",
      "format_policy": "percent_1",
      "definition": "Employed civilians divided by the civilian labor force; not an employment-to-population rate.",
      "source_authority_id": "DATA04_MICHIGAN_PUBLIC_DATA_PARITY_SOURCE_CONTRACT_V1",
      "source_label": "U.S. Census Bureau, 2020-2024 ACS 5-Year Detailed Tables",
      "scale_policy": "statewide_valid_p02_p98",
      "palette": "descriptive_sequential",
      "availability_policy": "Use only DATA-04 rows whose accepted measure status is valid.",
      "warning_policy": "Show DATA-04 status, status detail, and margin of error.",
      "input_binding": {"logical_input": "data04_candidate_measure", "measure_id": "employment_rate"},
      "synthetic_range": [75, 100]
    },
    {
      "metric_key": "bachelors_or_higher_share",
      "display_name": "Bachelor's Degree or Higher Share",
      "sort_order": 8,
      "family": "education_socioeconomic_structure",
      "unit": "percent of population age 25+",
      "format_policy": "percent_1",
      "definition": "People age 25 years and over with a bachelor's, master's, professional, or doctoral degree as a share of the age-25-plus population.",
      "source_authority_id": "DATA04_MICHIGAN_PUBLIC_DATA_PARITY_SOURCE_CONTRACT_V1",
      "source_label": "U.S. Census Bureau, 2020-2024 ACS 5-Year Detailed Tables",
      "scale_policy": "statewide_valid_p02_p98",
      "palette": "descriptive_sequential",
      "availability_policy": "Use only DATA-04 rows whose accepted measure status is valid.",
      "warning_policy": "Show DATA-04 status, status detail, and margin of error.",
      "input_binding": {"logical_input": "data04_candidate_measure", "measure_id": "bachelors_or_higher_share"},
      "synthetic_range": [5, 75]
    },
    {
      "metric_key": "owner_occupancy_share",
      "display_name": "Owner-Occupied Housing Share",
      "sort_order": 9,
      "family": "housing_neighborhood_economics",
      "unit": "percent of occupied housing units",
      "format_policy": "percent_1",
      "definition": "Owner-occupied housing units as a share of all occupied housing units; higher or lower values are not inherently favorable.",
      "source_authority_id": "DATA04_MICHIGAN_PUBLIC_DATA_PARITY_SOURCE_CONTRACT_V1",
      "source_label": "U.S. Census Bureau, 2020-2024 ACS 5-Year Detailed Tables",
      "scale_policy": "statewide_valid_p02_p98",
      "palette": "descriptive_sequential",
      "availability_policy": "Use only DATA-04 rows whose accepted measure status is valid.",
      "warning_policy": "Show DATA-04 status, status detail, and margin of error.",
      "input_binding": {"logical_input": "data04_candidate_measure", "measure_id": "owner_occupancy_share"},
      "synthetic_range": [20, 90]
    },
    {
      "metric_key": "vacancy_share",
      "display_name": "Vacant Housing Unit Share",
      "sort_order": 10,
      "family": "housing_neighborhood_economics",
      "unit": "percent of housing units",
      "format_policy": "percent_1",
      "definition": "Vacant housing units as a share of all housing units; it does not by itself imply market strength or weakness.",
      "source_authority_id": "DATA04_MICHIGAN_PUBLIC_DATA_PARITY_SOURCE_CONTRACT_V1",
      "source_label": "U.S. Census Bureau, 2020-2024 ACS 5-Year Detailed Tables",
      "scale_policy": "statewide_valid_p02_p98",
      "palette": "descriptive_sequential",
      "availability_policy": "Use only DATA-04 rows whose accepted measure status is valid.",
      "warning_policy": "Show DATA-04 status, status detail, and margin of error.",